{
  "dlqVersion": "1",
  "receivedAt": "2025-01-01T00:00:10Z",
  "source": {
    "broker": "kafka",
    "sourceTopic": "intersect.events",
    "partition": 7,
    "offset": 12345,
    "messageId": "kafka:intersect.events:7:12345",
    "headers": {
      "contentType": "application/json"
    }
  },
  "error": {
    "code": "UNKNOWN_EVENT",
    "message": "Unsupported eventName: TotallyUnknownEvent",
    "details": {
      "eventName": "TotallyUnknownEvent"
    }
  },
  "correlation": {
    "campaignId": "camp_123",
    "experimentRunId": "run_456",
    "traceId": "trace_789",
    "instrumentControllerId": "controller_sim_01"
  },
  "original": {
    "envelope": {
      "eventName": "TotallyUnknownEvent",
      "eventData": {
        "foo": "bar",
        "note": "This eventName is not part of the INTERSECT Instrument Controller capability contract."
      }
    },
    "raw": null
  }
}
